iswc,composition_title,writers,publishers,linked_isrc,notes
T-300100001-1,Bright Lights,"Mari Vega; Jordan Key","Lane Music Publishing 75; Atlas Songs 25",USRC18000001,Co-written; admin via Atlas Songs
T-300100002-2,Slow Lightning,"Mari Vega; Cam Reyes","Lane Music Publishing 100",USRC19000002,Contains 6-second interpolation — sample status flagged below
T-300100003-3,Coffee in Berlin,"Mari Vega","Lane Music Publishing 100",USRC19000003,Sole-writer
T-300100004-4,Long Way Home,"Mari Vega; Cam Reyes","Lane Music Publishing 100",USRC20000004,Co-writer named on lyrics; no signed split sheet on file
T-300100005-5,Dust on the Pages,"Mari Vega","Lane Music Publishing 100",USRC20000005,Sole-writer
